{
  "schema_version": "distill-handoff/proposal/v0alpha1",
  "request_id": "eb613088a5e48b03b2f1cac9c47a6a6338f02dc859e3f3e6afd0b686cb36df47",
  "request_sha256": "45d333595c146fcd8ade578f6015258dda8c57275b75352d63ca08f8c89fb4d2",
  "outcome": "no_decision",
  "route": "require_review",
  "reason": "The conversation explicitly deferred the decision.",
  "candidates": []
}
